<?xml version="1.0"?>

<!-- - - - - - - - - - - - - - - - - - - - - - - - - - - - - - - - - - - - -

	synthdev.xml

	This instrument definition is used by SynthEd.
	
	Copyright (c) 2002 by John Bair. ALL RIGHTS RESERVED.

	This program is free software; you can redistribute it and/or modify it 
	under the terms of the GNU General Public License as published by the 
	Free Software Foundation; either version 2 of the License, or (at your 
	option) any later version.
	
	This program is distributed in the hope that it will be useful, but 
	WITHOUT ANY WARRANTY; without even the implied warranty of 
	MERCHANTABILITY or FITNESS FOR A PARTICULAR PURPOSE. See the GNU 
	General Public License for more details.
	
	You should have received a copy of the GNU General Public License 
	along with this program; if not, write to the Free Software Foundation, 
	Inc., 59 Temple Place, Suite 330, Boston, MA 02111-1307 USA	
	
- - - - - - - - - - - - - - - - - - - - - - - - - - - - - - - - - - - - - -->

<!DOCTYPE instrument SYSTEM "../instrument.dtd">

<instrument id="synthdev">

	<module id="synthdev"/>
	
	<data>
	</data>
	
	<decoders>
		<decoder path="synthdev_decoder.xml"/>
	</decoders>
	
	<interfaces>
		<interface path="synthdev_ui.xml"/>
	</interfaces>
	
	<modes>
	</modes>
	
</instrument>
